{"apiVersion":"tplaiter.dev/template-lock/v2","dependencies":[],"kind":"DependencyExportLock","lockSHA256":"sha256:67971d9157204868cb3b641c0e06034eb64dd9b7fc888ec343c61149f5e6e033","rootLockSHA256":"sha256:0fdf1f81a9dd8a7ae8474a1ec5a63d47e395c6e1217e3cf8af0da9f5ca2efab1","trustProfile":{"apiVersion":"tplaiter.dev/trust-profile-binding/v1","assurance":"publisher-verified","authoritySHA256":"sha256:cccccccccccccccccccccccccccccccccccccccccccccccccccccccccccccccc","configSHA256":"sha256:aaaaaaaaaaaaaaaaaaaaaaaaaaaaaaaaaaaaaaaaaaaaaaaaaaaaaaaaaaaaaaaa","definitionVersion":1,"evidenceClass":"production","id":"oss","policySHA256":"sha256:bbbbbbbbbbbbbbbbbbbbbbbbbbbbbbbbbbbbbbbbbbbbbbbbbbbbbbbbbbbbbbbb"}}
